{
  "$schema": "./workflows.schema.json",
  "version": "0.1.0-review.1",
  "contractVersion": "0.1.0-review.1",
  "status": "proposed",
  "executionSemantics": "illustrative-not-executable",
  "description": "Reviewable user decisions and proposed information requirements. Roles describe interests, not permissions or separate databases. Required tables/fields identify draft capabilities, not evidence of populated BOS source fields. Detailed means worked through for contract review, not implemented or source-validated. Candidate workflows expose missing capabilities and have no promised output projection. Steps are explanatory pseudo-code, not a query language.",
  "roles": [
    {
      "id": "estimator",
      "label": "Cost estimator / quantity surveyor",
      "interests": [
        "Bid scope",
        "Measurement rules",
        "Price and quantity uncertainty"
      ]
    },
    {
      "id": "project_manager",
      "label": "Project manager",
      "interests": [
        "Package readiness",
        "Milestones",
        "Dependencies"
      ]
    },
    {
      "id": "general_contractor",
      "label": "General contractor",
      "interests": [
        "Coordination",
        "Scope allocation",
        "Delivery"
      ]
    },
    {
      "id": "roofer",
      "label": "Roofing contractor",
      "interests": [
        "Membrane and insulation quantities",
        "Roof edges and penetrations"
      ]
    },
    {
      "id": "facade_trade",
      "label": "Facade / glazing contractor",
      "interests": [
        "Panels and openings",
        "Interfaces",
        "Envelope quantities"
      ]
    },
    {
      "id": "partition_trade",
      "label": "Drywall / partition contractor",
      "interests": [
        "Faces and layers",
        "Opening deductions",
        "Fire and acoustic specifications"
      ]
    },
    {
      "id": "finishing_trade",
      "label": "Painter / finishing contractor",
      "interests": [
        "Room-facing finishes",
        "Preparation and coats"
      ]
    },
    {
      "id": "flooring_trade",
      "label": "Flooring / tiling contractor",
      "interests": [
        "Finish areas",
        "Skirting and transitions",
        "Waste"
      ]
    },
    {
      "id": "ceiling_trade",
      "label": "Ceiling contractor",
      "interests": [
        "Ceiling areas",
        "Soffits",
        "Access panels"
      ]
    },
    {
      "id": "door_supplier",
      "label": "Door / hardware supplier",
      "interests": [
        "Leaves and frames",
        "Hardware",
        "Clear opening and ratings"
      ]
    },
    {
      "id": "electrician",
      "label": "Electrical contractor",
      "interests": [
        "Circuits and panels",
        "Device schedules",
        "Cable and conduit routes"
      ]
    },
    {
      "id": "mechanical_trade",
      "label": "HVAC contractor",
      "interests": [
        "Ducts and insulation",
        "Equipment",
        "Maintenance access"
      ]
    },
    {
      "id": "plumbing_trade",
      "label": "Plumbing / sanitation contractor",
      "interests": [
        "Pipe lengths and slopes",
        "Fixtures",
        "Network connectivity"
      ]
    },
    {
      "id": "fire_protection_trade",
      "label": "Fire-protection contractor",
      "interests": [
        "Devices and zones",
        "Pipework",
        "Design input coverage"
      ]
    },
    {
      "id": "structural_trade",
      "label": "Concrete / rebar / steel / timber contractor",
      "interests": [
        "Material quantities",
        "Fabrication and erection packages"
      ]
    },
    {
      "id": "earthworks_trade",
      "label": "Civil / earthworks contractor",
      "interests": [
        "Terrain",
        "Cut and fill",
        "Drainage"
      ]
    },
    {
      "id": "landscape_trade",
      "label": "Landscape contractor",
      "interests": [
        "Planting and soil",
        "Irrigation",
        "Hardscape"
      ]
    },
    {
      "id": "safety_auditor",
      "label": "Safety auditor / site safety planner",
      "interests": [
        "Hazards",
        "Temporary work",
        "Access and inspection evidence"
      ]
    },
    {
      "id": "architect",
      "label": "Architect",
      "interests": [
        "Spatial program",
        "Envelope and openings",
        "Design requirements"
      ]
    },
    {
      "id": "interior_designer",
      "label": "Interior designer",
      "interests": [
        "Room data",
        "Finishes",
        "Fixtures and furniture"
      ]
    },
    {
      "id": "landscape_architect",
      "label": "Landscape architect",
      "interests": [
        "Land cover",
        "Planting",
        "Ecological and water scenarios"
      ]
    },
    {
      "id": "structural_engineer",
      "label": "Structural engineer",
      "interests": [
        "Members and connections",
        "Analytical assumptions",
        "Materials"
      ]
    },
    {
      "id": "civil_engineer",
      "label": "Civil engineer",
      "interests": [
        "Survey frames",
        "Terrain",
        "Infrastructure and drainage"
      ]
    },
    {
      "id": "electrical_engineer",
      "label": "Electrical engineer",
      "interests": [
        "Loads",
        "Circuits",
        "Equipment and topology"
      ]
    },
    {
      "id": "mechanical_engineer",
      "label": "Mechanical engineer",
      "interests": [
        "Air systems",
        "Service zones",
        "Performance inputs"
      ]
    },
    {
      "id": "plumbing_engineer",
      "label": "Plumbing / sanitation engineer",
      "interests": [
        "Supply and waste systems",
        "Flow and slope",
        "Design criteria"
      ]
    },
    {
      "id": "owner",
      "label": "Owner / asset manager",
      "interests": [
        "Handover",
        "Investment and renewal",
        "Portfolio comparability"
      ]
    },
    {
      "id": "facility_manager",
      "label": "Facility manager",
      "interests": [
        "Asset location",
        "Maintenance records",
        "Service dependencies"
      ]
    },
    {
      "id": "performance_analyst",
      "label": "Building-performance analyst",
      "interests": [
        "Envelope and occupancy inputs",
        "Simulated and observed results"
      ]
    },
    {
      "id": "sustainability_analyst",
      "label": "Sustainability / ecological-impact analyst",
      "interests": [
        "Material impact",
        "Lifecycle boundaries",
        "Water and habitat"
      ]
    },
    {
      "id": "portfolio_analyst",
      "label": "Portfolio analyst",
      "interests": [
        "Comparable building metrics",
        "Coverage",
        "Selected revisions"
      ]
    }
  ],
  "workflows": [
    {
      "id": "roof_takeoff",
      "title": "Roof quantities by assembly",
      "roleIds": [
        "roofer",
        "estimator",
        "architect"
      ],
      "question": "How much roof membrane and insulation does this building need, by assembly, and which roofs remain unmeasured?",
      "decision": "Prepare a measured bid scope and identify unresolved quantities before applying waste or pricing.",
      "parameters": [
        {
          "id": "snapshot_selection",
          "description": "Explicit snapshot(s) and project/building scope; do not combine overlapping revisions as additional objects.",
          "required": true
        },
        {
          "id": "measurement_rule",
          "description": "Named/versioned surface-area and deduction rules.",
          "required": true
        },
        {
          "id": "assembly_scope",
          "description": "Requested layers or assembly definitions; never infer layer thickness from area.",
          "required": true
        }
      ],
      "requiredTables": [
        "roof_takeoff",
        "quantity_observations",
        "quantity_scopes"
      ],
      "requiredFields": [
        "roof_takeoff.objectId",
        "roof_takeoff.location",
        "roof_takeoff.assembly",
        "roof_takeoff.netSurfaceArea",
        "roof_takeoff.projectedArea",
        "quantity_observations.basis",
        "quantity_observations.selectionState",
        "quantity_scopes.id",
        "quantity_scopes.objectId",
        "quantity_scopes.kind"
      ],
      "outputTables": [
        "roof_takeoff"
      ],
      "steps": [
        {
          "id": "establish_measurement_subject",
          "reads": [
            "quantity_scopes.id",
            "quantity_scopes.objectId",
            "quantity_scopes.kind"
          ],
          "pseudocode": "Select distinct whole-object, material-part or surface measurement subjects appropriate to the decision. Do not add overlapping whole-object and part quantities."
        },
        {
          "id": "select_roofs",
          "reads": [
            "roof_takeoff.objectId",
            "roof_takeoff.location"
          ],
          "pseudocode": "Select roof occurrences in the requested snapshot and building scope; retain unresolved location as an explicit scope exception."
        },
        {
          "id": "select_measurements",
          "reads": [
            "roof_takeoff.netSurfaceArea",
            "roof_takeoff.projectedArea",
            "quantity_observations.basis",
            "quantity_observations.selectionState"
          ],
          "pseudocode": "Use the accepted net surface-area observation under the requested rule; do not substitute plan-projected area or sum competing observations."
        },
        {
          "id": "group_and_report",
          "reads": [
            "roof_takeoff.assembly",
            "roof_takeoff.netSurfaceArea"
          ],
          "pseudocode": "Group compatible measured contributions by assembly; return measured subtotal, unmeasured roof count and exclusions. Report insulation volume only if its required thickness evidence is supplied."
        }
      ],
      "policies": [